{
  "$schema": "hoverpocket://schemas/receipt/v1",
  "invocationId": "invocation-timer-start-001",
  "status": "succeeded",
  "capability": {
    "id": "timer.countdown.start",
    "version": 1
  },
  "output": {
    "timerId": "123e4567-e89b-12d3-a456-426614174000",
    "state": "running",
    "endAt": "2026-08-13T12:10:00Z"
  },
  "readback": {
    "status": "verified",
    "strategy": "capability_query",
    "observedAt": "2026-08-13T12:00:02Z",
    "evidenceDigest": "sha256:2fcd64001b1f4ca9eaf2979723523222b45a637455664cea62689676a0fe80c5"
  },
  "rollback": {
    "available": true,
    "status": "not_requested"
  },
  "auditEntryId": "audit-timer-start-001",
  "completedAt": "2026-08-13T12:00:02Z"
}
